[
  {
    "id": "all-ui-components",
    "name": "UI Components",
    "description": "All Halogen UI components",
    "sparql": "PREFIX gbk: <https://lambdasistemi.github.io/graph-browser/vocab/kinds#>\nSELECT ?node WHERE { ?node a gbk:component }",
    "tags": []
  },
  {
    "id": "all-modules",
    "name": "PureScript Modules",
    "description": "All PureScript logic modules",
    "sparql": "PREFIX gbk: <https://lambdasistemi.github.io/graph-browser/vocab/kinds#>\nSELECT ?node WHERE { ?node a gbk:module }",
    "tags": []
  },
  {
    "id": "all-ffi",
    "name": "FFI Bindings",
    "description": "All JavaScript FFI wrappers",
    "sparql": "PREFIX gbk: <https://lambdasistemi.github.io/graph-browser/vocab/kinds#>\nSELECT ?node WHERE { ?node a gbk:ffi }",
    "tags": []
  },
  {
    "id": "all-schemas",
    "name": "JSON Schemas",
    "description": "All validation schemas",
    "sparql": "PREFIX gbk: <https://lambdasistemi.github.io/graph-browser/vocab/kinds#>\nSELECT ?node WHERE { ?node a gbk:schema }",
    "tags": []
  },
  {
    "id": "data-types",
    "name": "Data Types",
    "description": "Core data type definitions",
    "sparql": "PREFIX gbk: <https://lambdasistemi.github.io/graph-browser/vocab/kinds#>\nSELECT ?node WHERE { ?node a gbk:type }",
    "tags": []
  },
  {
    "id": "concepts",
    "name": "Design Concepts",
    "description": "Architectural concepts and principles",
    "sparql": "PREFIX gbk: <https://lambdasistemi.github.io/graph-browser/vocab/kinds#>\nSELECT ?node WHERE { ?node a gbk:concept }",
    "tags": []
  },
  {
    "id": "ffi-boundary",
    "name": "FFI Boundary",
    "description": "Everything that crosses the PureScript / JavaScript border.",
    "sparql": "PREFIX rdf: <http://www.w3.org/1999/02/22-rdf-syntax-ns#>\nPREFIX dcterms: <http://purl.org/dc/terms/>\nPREFIX gb: <https://lambdasistemi.github.io/graph-browser/vocab/terms#>\nPREFIX gbk: <https://lambdasistemi.github.io/graph-browser/vocab/kinds#>\nSELECT DISTINCT ?node WHERE {\n  { ?node a gbk:ffi }\n  UNION {\n    ?ffi a gbk:ffi ; ?p ?node .\n    ?node gb:nodeId ?nodeId .\n    FILTER(?p != rdf:type && ?p != gb:group && ?p != dcterms:isPartOf)\n  }\n  UNION {\n    ?node ?p ?ffi .\n    ?ffi a gbk:ffi .\n    ?node gb:nodeId ?nodeId .\n    FILTER(?p != rdf:type && ?p != gb:group && ?p != dcterms:isPartOf)\n  }\n}",
    "tags": ["view"]
  },
  {
    "id": "external-deps",
    "name": "External Dependencies",
    "description": "Third-party libraries and frameworks the project depends on.",
    "sparql": "PREFIX gb: <https://lambdasistemi.github.io/graph-browser/vocab/terms#>\nPREFIX gbg: <https://lambdasistemi.github.io/graph-browser/vocab/groups#>\nSELECT ?node WHERE { ?node gb:group gbg:external }",
    "tags": []
  },
  {
    "id": "validation-chain",
    "name": "Validation Chain",
    "description": "What validates what — CI validators and their schema targets.",
    "sparql": "PREFIX gb: <https://lambdasistemi.github.io/graph-browser/vocab/terms#>\nPREFIX gbe: <https://lambdasistemi.github.io/graph-browser/vocab/edges#>\nSELECT DISTINCT ?node WHERE {\n  { ?node gbe:validates%20against ?target }\n  UNION { ?source gbe:validates%20against ?node }\n}",
    "tags": []
  },
  {
    "id": "data-pipeline",
    "name": "Data Pipeline",
    "description": "The full path from data loading through indexing, filtering, and rendering.",
    "sparql": "PREFIX gb: <https://lambdasistemi.github.io/graph-browser/vocab/terms#>\nPREFIX gbg: <https://lambdasistemi.github.io/graph-browser/vocab/groups#>\nSELECT DISTINCT ?node WHERE {\n  { ?node gb:group gbg:data-loading }\n  UNION { ?node gb:group gbg:graph-core }\n  UNION { ?node gb:nodeId \"graph-cytoscape\" }\n  UNION { ?node gb:nodeId \"ffi-cytoscape\" }\n}",
    "tags": ["view"]
  },
  {
    "id": "leaf-nodes",
    "name": "Leaf Nodes",
    "description": "Entry points and terminal dependencies — nodes with only one connection.",
    "sparql": "PREFIX rdf: <http://www.w3.org/1999/02/22-rdf-syntax-ns#>\nPREFIX dcterms: <http://purl.org/dc/terms/>\nPREFIX gb: <https://lambdasistemi.github.io/graph-browser/vocab/terms#>\nSELECT ?node WHERE {\n  { SELECT ?node (COUNT(*) AS ?c) WHERE {\n    { ?node ?p ?other . ?other gb:nodeId ?otherId }\n    UNION { ?other ?p ?node . ?other gb:nodeId ?otherId }\n    FILTER(?p != rdf:type && ?p != gb:group && ?p != dcterms:isPartOf)\n  } GROUP BY ?node HAVING (COUNT(*) = 1) }\n}",
    "tags": []
  },
  {
    "id": "hub-nodes",
    "name": "Hub Nodes",
    "description": "The most connected nodes — architectural load-bearing components.",
    "sparql": "PREFIX rdf: <http://www.w3.org/1999/02/22-rdf-syntax-ns#>\nPREFIX dcterms: <http://purl.org/dc/terms/>\nPREFIX gb: <https://lambdasistemi.github.io/graph-browser/vocab/terms#>\nSELECT ?node WHERE {\n  { SELECT ?node (COUNT(*) AS ?c) WHERE {\n    { ?node ?p ?other . ?other gb:nodeId ?otherId }\n    UNION { ?other ?p ?node . ?other gb:nodeId ?otherId }\n    FILTER(?p != rdf:type && ?p != gb:group && ?p != dcterms:isPartOf)\n  } GROUP BY ?node HAVING (COUNT(*) > 4) }\n}",
    "tags": []
  },
  {
    "id": "viewer-deps",
    "name": "Viewer Dependencies",
    "description": "Everything the Viewer component depends on (transitive).",
    "sparql": "PREFIX gb: <https://lambdasistemi.github.io/graph-browser/vocab/terms#>\nPREFIX gbe: <https://lambdasistemi.github.io/graph-browser/vocab/edges#>\nSELECT DISTINCT ?node WHERE {\n  <https://github.com/lambdasistemi/graph-browser/rdf/node/viewer> ?p ?node .\n  ?node a ?type .\n  FILTER(?p != <http://www.w3.org/1999/02/22-rdf-syntax-ns#type>)\n}",
    "tags": []
  },
  {
    "id": "graph-core",
    "name": "Graph Core",
    "description": "Pure graph operations: types, build, operations, search — no UI, no FFI.",
    "sparql": "PREFIX gb: <https://lambdasistemi.github.io/graph-browser/vocab/terms#>\nPREFIX gbg: <https://lambdasistemi.github.io/graph-browser/vocab/groups#>\nSELECT ?node WHERE { ?node gb:group gbg:graph-core }",
    "tags": []
  },
  {
    "id": "by-kind",
    "name": "Nodes by Kind",
    "description": "All nodes of a selected kind.",
    "sparql": "PREFIX gbk: <https://lambdasistemi.github.io/graph-browser/vocab/kinds#>\nSELECT ?node WHERE { ?node a gbk:$kind }",
    "parameters": [{ "name": "kind", "label": "Kind", "type": "kind" }],
    "tags": []
  },
  {
    "id": "by-group",
    "name": "Nodes by Group",
    "description": "All nodes in a selected group.",
    "sparql": "PREFIX gb: <https://lambdasistemi.github.io/graph-browser/vocab/terms#>\nSELECT ?node WHERE { ?node gb:group \"$group\" }",
    "parameters": [{ "name": "group", "label": "Group", "type": "group" }],
    "tags": []
  },
  {
    "id": "build-validation",
    "name": "Build & Validation",
    "description": "Nix build system, schemas, and CI validation pipeline.",
    "sparql": "PREFIX gbk: <https://lambdasistemi.github.io/graph-browser/vocab/kinds#>\nPREFIX gb: <https://lambdasistemi.github.io/graph-browser/vocab/terms#>\nSELECT DISTINCT ?node WHERE {\n  { ?node a gbk:build }\n  UNION { ?node a gbk:output }\n  UNION { ?node a gbk:schema }\n  UNION { ?node gb:nodeId \"validate-workflow\" }\n  UNION { ?node gb:nodeId \"validate-action\" }\n  UNION { ?node gb:nodeId \"build-action\" }\n  UNION { ?node gb:nodeId \"data-driven\" }\n}",
    "tags": ["view"]
  },
  {
    "id": "ui-rendering",
    "name": "UI & Rendering",
    "description": "The viewer component, graph operations, and Cytoscape rendering pipeline.",
    "sparql": "PREFIX gbk: <https://lambdasistemi.github.io/graph-browser/vocab/kinds#>\nPREFIX gb: <https://lambdasistemi.github.io/graph-browser/vocab/terms#>\nSELECT DISTINCT ?node WHERE {\n  { ?node a gbk:component }\n  UNION { ?node a gbk:module }\n  UNION { ?node a gbk:ffi }\n  UNION { ?node gb:nodeId \"halogen\" }\n  UNION { ?node gb:nodeId \"cytoscape-js\" }\n  UNION { ?node gb:nodeId \"depth-filtering\" }\n}",
    "tags": ["view"]
  },
  {
    "id": "nix-build",
    "name": "Nix Build Nodes",
    "description": "The flake, bundlers, and build outputs.",
    "sparql": "PREFIX gbk: <https://lambdasistemi.github.io/graph-browser/vocab/kinds#>\nSELECT ?node WHERE { { ?node a gbk:build } UNION { ?node a gbk:output } }",
    "tags": ["tour:build-pipeline"]
  },
  {
    "id": "validation-nodes",
    "name": "Validation Pipeline",
    "description": "CI validation workflow and schema nodes.",
    "sparql": "PREFIX gbk: <https://lambdasistemi.github.io/graph-browser/vocab/kinds#>\nPREFIX gb: <https://lambdasistemi.github.io/graph-browser/vocab/terms#>\nSELECT DISTINCT ?node WHERE {\n  { ?node a gbk:schema }\n  UNION { ?node gb:nodeId \"validate-workflow\" }\n  UNION { ?node gb:nodeId \"validate-action\" }\n}",
    "tags": ["tour:build-pipeline"]
  },
  {
    "id": "viewer-neighborhood",
    "name": "Viewer Component",
    "description": "The central Halogen component and its direct connections.",
    "sparql": "PREFIX gb: <https://lambdasistemi.github.io/graph-browser/vocab/terms#>\nSELECT DISTINCT ?node WHERE {\n  { ?node gb:nodeId \"viewer\" }\n  UNION { <https://github.com/lambdasistemi/graph-browser/rdf/node/viewer> ?p ?node . ?node a ?type }\n  UNION { ?node ?p <https://github.com/lambdasistemi/graph-browser/rdf/node/viewer> . ?node a ?type }\n}",
    "tags": ["tour:rendering-pipeline"]
  },
  {
    "id": "decode-nodes",
    "name": "Decoding Layer",
    "description": "Graph decoding and type foundation.",
    "sparql": "PREFIX gb: <https://lambdasistemi.github.io/graph-browser/vocab/terms#>\nSELECT DISTINCT ?node WHERE {\n  { ?node gb:nodeId \"graph-decode\" }\n  UNION { ?node gb:nodeId \"graph-types\" }\n}",
    "tags": ["tour:rendering-pipeline", "tour:data-pipeline"]
  },
  {
    "id": "ffi-rendering",
    "name": "FFI Rendering",
    "description": "Cytoscape FFI wrapper and the JS library.",